book,author,quote,read,pages,type,genreAtomic Habits,James Clear,"You don’t realize how valuable it is to just show up on your bad (or busy) days. Lost days hurt you more than successful days help you. If you start with $100, then a 50 percent gain will take you to $150. But you only need a 33 percent loss to take you back to $100. In other words, avoiding a 33 percent loss is just as valuable as achieving a 50 percent gain. As Charlie Munger says, “The first rule of compounding: Never interrupt it unnecessarily.”",octobre 2022,319,Livre,Non-Fiction
Atomic Habits,James Clear,"Don’t break the chain. Try to keep your habit streak alive. Never miss twice. If you miss one day, try to get back on track as quickly as possible. Just because you can measure something doesn’t mean it’s the most important thing.",octobre 2022,319,Livre,Non-Fiction
Atomic Habits,James Clear,"The inversion of the 4th Law of Behavior Change is make it unsatisfying. We are less likely to repeat a bad habit if it is painful or unsatisfying. An accountability partner can create an immediate cost to inaction. We care deeply about what others think of us, and we do not want others to have a lesser opinion of us. A habit contract can be used to add a social cost to any behavior. It makes the costs of violating your promises public and painful. Knowing that someone else is watching you can be a powerful motivator.",octobre 2022,319,Livre,Non-Fiction
Atomic Habits,James Clear,"You don’t have to build the habits everyone tells you to build. Choose the habit that best suits you, not the one that is most popular. There is a version of every habit that can bring you joy and satisfaction. Find it. Habits need to be enjoyable if they are going to stick. ",octobre 2022,319,Livre,Non-Fiction
Atomic Habits,James Clear,"When you can’t win by being better, you can win by being different. By combining your skills, you reduce the level of competition, which makes it easier to stand out. You can shortcut the need for a genetic advantage (or for years of practice) by rewriting the rules. A good player works hard to win the game everyone else is playing. A great player creates a new game that favors their strengths and avoids their weaknesses.",octobre 2022,319,Livre,Non-Fiction
Atomic Habits,James Clear,The Goldilocks Rule states that humans experience peak motivation when working on tasks that are right on the edge of their current abilities. Not too hard. Not too easy. Just right.,octobre 2022,319,Livre,Non-Fiction
Atomic Habits,James Clear,"Improvement requires a delicate balance. You need to regularly search for challenges that push you to your edge while continuing to make enough progress to stay motivated. Behaviors need to remain novel in order for them to stay attractive and satisfying. Without variety, we get bored. And boredom is perhaps the greatest villain on the quest for self-improvement.",octobre 2022,319,Livre,Non-Fiction
Atomic Habits,James Clear,"As Machiavelli noted, “Men desire novelty to such an extent that those who are doing well wish for a change as much as those who are doing badly.",octobre 2022,319,Livre,Non-Fiction
Atomic Habits,James Clear,"no habit will stay interesting forever. At some point, everyone faces the same challenge on the journey of self-improvement: you have to fall in love with boredom.",octobre 2022,319,Livre,Non-Fiction
Atomic Habits,James Clear,"When a habit is truly important to you, you have to be willing to stick to it in any mood. Professionals take action even when the mood isn’t right. They might not enjoy it, but they find a way to put the reps in.",octobre 2022,319,Livre,Non-Fiction
Atomic Habits,James Clear,"When you know the simple movements so well that you can perform them without thinking, you are free to pay attention to more advanced details. In this way, habits are the backbone of any pursuit of excellence.",octobre 2022,319,Livre,Non-Fiction
Atomic Habits,James Clear,"However, the benefits of habits come at a cost. At first, each repetition develops fluency, speed, and skill. But then, as a habit becomes automatic, you become less sensitive to feedback. You fall into mindless repetition. It becomes easier to let mistakes slide. When you can do it “good enough” on autopilot, you stop thinking about how to do it better.",octobre 2022,319,Livre,Non-Fiction
Atomic Habits,James Clear,It is precisely at the moment when you begin to feel like you have mastered a skill—right when things are starting to feel automatic and you are becoming comfortable—that you must avoid slipping into the trap of complacency.,octobre 2022,319,Livre,Non-Fiction
Atomic Habits,James Clear,"Men are born soft and supple; dead, they are stiff and hard. Plants are born tender and pliant; dead, they are brittle and dry. Thus whoever is stiff and inflexible is a disciple of death. Whoever is soft and yielding is a disciple of life. The hard and stiff will be broken. The soft and supple will prevail. —LAO TZU",octobre 2022,319,Livre,Non-Fiction
Atomic Habits,James Clear,"Reflection and review is a process that allows you to remain conscious of your performance over time. The tighter we cling to an identity, the harder it becomes to grow beyond it.",octobre 2022,319,Livre,Non-Fiction
Atomic Habits,James Clear,"Being curious is better than being smart. Being motivated and curious counts for more than being smart because it leads to action. Being smart will never deliver results on its own because it doesn’t get you to act. It is desire, not intelligence, that prompts behavior. As Naval Ravikant says, “The trick to doing anything is first cultivating a desire for it.”",octobre 2022,319,Livre,Non-Fiction
